{
  "$schema": "https://json-schema.org/draft/2020-12/schema",
  "$id": "https://openwop.dev/spec/v2/trigger-event.schema.json",
  "title": "TriggerEvent",
  "description": "RFC 0099 \u00a7F.1. The normalized external-event envelope a host hands a started run as `ctx.triggerData` when an externally-originated event (`webhook`/`email`/`form`/`stream`/`change`) is delivered to an `active` TriggerSubscription (RFC 0083). This is an IN-RUN payload only \u2014 it never appears on the durable event log; the `trigger.delivery.attempted` event stays content-free (RFC 0083 \u00a7C / SECURITY `trigger-ingestion-content-redaction`). A TriggerEvent carries exactly the per-source sub-object matching its `source`. All content is `untrusted` (SECURITY `threat-model-prompt-injection.md`).",
  "type": "object",
  "additionalProperties": false,
  "required": [
    "source",
    "subscriptionId",
    "deliveryId",
    "receivedAt"
  ],
  "properties": {
    "source": {
      "type": "string",
      "enum": [
        "webhook",
        "email",
        "form",
        "stream",
        "change"
      ],
      "description": "Which external source originated the event. A TriggerEvent MUST carry exactly the per-source sub-object matching this value and MUST NOT carry the others (RFC 0099 \u00a7F.1; `stream`/`change` per RFC 0127)."
    },
    "subscriptionId": {
      "$ref": "ids.schema.json#/$defs/subscriptionId",
      "description": "The RFC 0083 \u00a7B subscription this event was delivered to."
    },
    "deliveryId": {
      "$ref": "ids.schema.json#/$defs/deliveryId",
      "description": "Stable per-delivery id for this trigger delivery, tenant-bound per `identity.md` \u00a75. **It is NOT the `causationId` stamped on `run.started`.** An earlier revision of this description said it was; that claim was unsatisfiable from the moment RFC 0184/0187 made this kind tenant-bound \u2014 `deliveryId` REQUIRES a `<tenant>/<opaque>` form and `causationId` is typed as `eventId`, whose grammar admits no `/`, so no string can be both. No host emitted the pairing (the kind has no v2 read surface at all), so nothing was relying on it. How a run points back at the delivery that caused it is deliberately left open: RFC 0040 \u00a7Alternatives already rejected overloading `causationId` for a cross-space pointer in favour of a sibling field, and the v2 seat does NOT belong in `spec/v2/core/webhooks.md` \u2014 that document is OUTBOUND (a host POSTs matching events to a registered URL) while this pointer is INBOUND (an external event arrives, a run starts). It belongs on the durable event-log payload, in a trigger-ingestion document `spec/v2/core/` does not yet have (RFC 0187 \u00a7Acceptance criteria tracks the gap). A normative cross-field rule does not belong in a schema description in the first place."
    },
    "dedupKey": {
      "type": "string",
      "description": "The host-opaque dedup key (RFC 0083 \u00a7C-1). Present iff the subscription's `dedupEnabled`. MUST NOT embed inbound body/header content in cleartext (SECURITY `trigger-ingestion-content-redaction`)."
    },
    "receivedAt": {
      "type": "string",
      "format": "date-time",
      "description": "When the host received the external event."
    },
    "verified": {
      "type": "boolean",
      "description": "Whether the host verified the source's authenticity (webhook signature / email DMARC / form CSRF+origin) before delivery per the subscription's `verification` policy (RFC 0099 \u00a7F.2). A run MUST be able to gate on this."
    },
    "contentTrust": {
      "type": "string",
      "enum": [
        "untrusted"
      ],
      "description": "Always `untrusted`. Inbound external content reaching an LLM node MUST be wrapped per `threat-model-prompt-injection.md` \u00a7UNTRUSTED; a TriggerEvent MUST NOT directly advance a HITL approval gate (the `prompt-injection-mcp-no-approval` invariant generalizes)."
    },
    "permittedPurposes": {
      "type": "array",
      "items": {
        "type": "string"
      },
      "description": "RFC 0128 \u2014 OPTIONAL declared uses the receiver is permitted to make of the accompanying data. Opaque purpose strings mapped to the host's local vocabulary; carries purpose categories only, never subject identifiers or consent records. Absent \u21d2 unlabelled (no constraint asserted); `[]` \u21d2 no onward use permitted (NOT the same as absent). A host advertising `purposePropagation` MUST honor the RFC 0128 \u00a73 propagation rules for this label."
    },
    "webhook": {
      "$ref": "#/$defs/WebhookEvent"
    },
    "email": {
      "$ref": "#/$defs/EmailEvent"
    },
    "form": {
      "$ref": "#/$defs/FormEvent"
    },
    "stream": {
      "$ref": "#/$defs/StreamEvent"
    },
    "change": {
      "$ref": "#/$defs/ChangeEvent"
    }
  },
  "allOf": [
    {
      "description": "RFC 0099 \u00a7F.1 \u2014 a TriggerEvent MUST carry exactly the per-source sub-object matching its `source` and MUST NOT carry the others.",
      "if": {
        "properties": {
          "source": {
            "const": "webhook"
          }
        }
      },
      "then": {
        "not": {
          "anyOf": [
            {
              "required": [
                "email"
              ]
            },
            {
              "required": [
                "form"
              ]
            },
            {
              "required": [
                "stream"
              ]
            },
            {
              "required": [
                "change"
              ]
            }
          ]
        }
      }
    },
    {
      "if": {
        "properties": {
          "source": {
            "const": "email"
          }
        }
      },
      "then": {
        "not": {
          "anyOf": [
            {
              "required": [
                "webhook"
              ]
            },
            {
              "required": [
                "form"
              ]
            },
            {
              "required": [
                "stream"
              ]
            },
            {
              "required": [
                "change"
              ]
            }
          ]
        }
      }
    },
    {
      "if": {
        "properties": {
          "source": {
            "const": "form"
          }
        }
      },
      "then": {
        "not": {
          "anyOf": [
            {
              "required": [
                "webhook"
              ]
            },
            {
              "required": [
                "email"
              ]
            },
            {
              "required": [
                "stream"
              ]
            },
            {
              "required": [
                "change"
              ]
            }
          ]
        }
      }
    },
    {
      "if": {
        "properties": {
          "source": {
            "const": "stream"
          }
        }
      },
      "then": {
        "not": {
          "anyOf": [
            {
              "required": [
                "webhook"
              ]
            },
            {
              "required": [
                "email"
              ]
            },
            {
              "required": [
                "form"
              ]
            },
            {
              "required": [
                "change"
              ]
            }
          ]
        }
      }
    },
    {
      "if": {
        "properties": {
          "source": {
            "const": "change"
          }
        }
      },
      "then": {
        "not": {
          "anyOf": [
            {
              "required": [
                "webhook"
              ]
            },
            {
              "required": [
                "email"
              ]
            },
            {
              "required": [
                "form"
              ]
            },
            {
              "required": [
                "stream"
              ]
            }
          ]
        }
      }
    }
  ],
  "$defs": {
    "WebhookEvent": {
      "type": "object",
      "additionalProperties": false,
      "description": "Present iff `source == \"webhook\"`.",
      "properties": {
        "method": {
          "type": "string",
          "enum": [
            "POST",
            "PUT",
            "PATCH"
          ]
        },
        "headers": {
          "type": "object",
          "additionalProperties": {
            "type": "string"
          },
          "description": "Host-allowlisted headers only \u2014 a host MUST NOT pass through `Authorization`, `Cookie`, `Proxy-Authorization`, or any header carrying credential material (RFC 0099 \u00a7F.1 / SECURITY `trigger-ingestion-content-redaction`)."
        },
        "body": {
          "description": "The parsed JSON body, or a string for non-JSON. Bounded by `triggerBridge.ingestion.maxBodyBytes`."
        }
      }
    },
    "EmailEvent": {
      "type": "object",
      "additionalProperties": false,
      "description": "Present iff `source == \"email\"`.",
      "properties": {
        "from": {
          "type": "string"
        },
        "to": {
          "type": "array",
          "items": {
            "type": "string"
          }
        },
        "subject": {
          "type": "string"
        },
        "text": {
          "type": "string"
        },
        "html": {
          "type": "string"
        },
        "attachments": {
          "type": "array",
          "items": {
            "$ref": "#/$defs/AttachmentRef"
          }
        }
      }
    },
    "FormEvent": {
      "type": "object",
      "additionalProperties": false,
      "description": "Present iff `source == \"form\"`.",
      "properties": {
        "fields": {
          "type": "object",
          "additionalProperties": true,
          "description": "The submitted field map."
        },
        "files": {
          "type": "array",
          "items": {
            "$ref": "#/$defs/AttachmentRef"
          }
        }
      }
    },
    "StreamEvent": {
      "type": "object",
      "additionalProperties": false,
      "description": "Present iff `source == \"stream\"` (RFC 0127). One message consumed from a streaming broker (Kafka / Kinesis / Pub-Sub); the host is the consumer and each delivered message normalizes to one TriggerEvent. The broker connection is a credential-brokered egress (RFC 0095), never a wire field.",
      "properties": {
        "topic": {
          "type": "string",
          "description": "The broker topic/stream/subscription name the message was consumed from."
        },
        "partition": {
          "type": "integer",
          "minimum": 0,
          "description": "Broker partition/shard, where the broker has one. With `offset`, feeds the RFC 0127 \u00a74 dedup-key guidance `(topic, partition, offset)`."
        },
        "offset": {
          "type": "string",
          "description": "Broker offset / sequence number as an opaque string (brokers disagree on integer width)."
        },
        "key": {
          "type": "string",
          "description": "The message key, where the broker has one."
        },
        "message": {
          "description": "The consumed message payload \u2014 parsed JSON, or a string for non-JSON. Bounded by `triggerBridge.ingestion.maxBodyBytes`."
        }
      }
    },
    "ChangeEvent": {
      "type": "object",
      "additionalProperties": false,
      "required": [
        "op"
      ],
      "description": "Present iff `source == \"change\"` (RFC 0127). One change-data-capture record from a warehouse/database changelog. `op` is REQUIRED. The warehouse connection is a credential-brokered egress (RFC 0095), never a wire field.",
      "properties": {
        "op": {
          "type": "string",
          "enum": [
            "insert",
            "update",
            "delete"
          ],
          "description": "The change operation. REQUIRED (RFC 0127 \u00a72 / resolved Q1 \u2014 one `change` source with an `op` discriminator, not per-verb sources)."
        },
        "table": {
          "type": "string",
          "description": "The source table/collection/entity name. With `changelogId`, feeds the RFC 0127 \u00a74 dedup-key guidance `(table, changelog-id)`."
        },
        "changelogId": {
          "type": "string",
          "description": "The changelog position/LSN/row-version as an opaque string."
        },
        "before": {
          "description": "The pre-image row where the feed provides one (typically `update`/`delete`). Parsed JSON. Bounded by `triggerBridge.ingestion.maxBodyBytes`."
        },
        "after": {
          "description": "The post-image row where the feed provides one (typically `insert`/`update`). Parsed JSON. Bounded by `triggerBridge.ingestion.maxBodyBytes`."
        }
      }
    },
    "AttachmentRef": {
      "type": "object",
      "additionalProperties": false,
      "required": [
        "ref"
      ],
      "description": "A host-internal opaque handle to a resolved attachment/upload \u2014 NEVER a raw external URL the run is expected to fetch itself (RFC 0099 \u00a7F.1/\u00a7F.4). The host resolves and ingests attachments through its SSRF guard (SECURITY `trigger-ingestion-ssrf`), then hands the run an internal ref.",
      "properties": {
        "ref": {
          "type": "string",
          "minLength": 1,
          "description": "A host-internal opaque handle (e.g. a `host.blobStorage` key)."
        },
        "filename": {
          "type": "string"
        },
        "mediaType": {
          "type": "string"
        },
        "bytes": {
          "type": "integer",
          "minimum": 0
        }
      }
    }
  },
  "examples": [
    {
      "source": "email",
      "subscriptionId": "acme/sub_7-xxxxxxxxxx",
      "deliveryId": "acme/dlv_a1b2-xxxxxxx",
      "dedupKey": "msgid:abc@in.example.com",
      "receivedAt": "2026-06-13T18:04:11Z",
      "verified": true,
      "contentTrust": "untrusted",
      "email": {
        "from": "customer@example.org",
        "to": [
          "triage-support+sub_7@in.example.com"
        ],
        "subject": "Cannot log in",
        "text": "I keep getting a 403.",
        "attachments": [
          {
            "ref": "blob_a1",
            "filename": "screenshot.png",
            "mediaType": "image/png",
            "bytes": 20481
          }
        ]
      }
    },
    {
      "source": "webhook",
      "subscriptionId": "acme/sub_9-xxxxxxxxxx",
      "deliveryId": "acme/dlv_c3d4-xxxxxxx",
      "receivedAt": "2026-06-13T18:10:00Z",
      "verified": true,
      "contentTrust": "untrusted",
      "webhook": {
        "method": "POST",
        "headers": {
          "X-Event-Type": "issue.created"
        },
        "body": {
          "issue": {
            "id": 42,
            "title": "Bug"
          }
        }
      }
    },
    {
      "source": "stream",
      "subscriptionId": "acme/sub_12-xxxxxxxxx",
      "deliveryId": "acme/dlv_e5f6-xxxxxxx",
      "dedupKey": "events:3:88412",
      "receivedAt": "2026-07-06T12:00:00Z",
      "verified": true,
      "contentTrust": "untrusted",
      "stream": {
        "topic": "events",
        "partition": 3,
        "offset": "88412",
        "key": "user_77",
        "message": {
          "type": "page_view",
          "path": "/pricing"
        }
      }
    },
    {
      "source": "change",
      "subscriptionId": "acme/sub_13-xxxxxxxxx",
      "deliveryId": "acme/dlv_a7b8-xxxxxxx",
      "dedupKey": "contacts:lsn:0/1C4F9D0",
      "receivedAt": "2026-07-06T12:01:00Z",
      "verified": true,
      "contentTrust": "untrusted",
      "permittedPurposes": [
        "analytics"
      ],
      "change": {
        "op": "update",
        "table": "contacts",
        "changelogId": "0/1C4F9D0",
        "before": {
          "id": 77,
          "tier": "free"
        },
        "after": {
          "id": 77,
          "tier": "pro"
        }
      }
    }
  ],
  "x-openwop-seeded-from": "v1"
}
