{
  "source": "email",
  "subscriptionId": "sub_7",
  "deliveryId": "dlv_a1b2",
  "dedupKey": "msgid:abc@in.example.com",
  "receivedAt": "2026-06-13T18:04:11Z",
  "verified": true,
  "contentTrust": "untrusted",
  "email": {
    "from": "customer@example.org",
    "to": ["triage-support+sub_7@in.example.com"],
    "subject": "Cannot log in",
    "text": "I keep getting a 403.",
    "attachments": [
      { "ref": "blob_a1", "filename": "screenshot.png", "mediaType": "image/png", "bytes": 20481 }
    ]
  }
}
